J,"Medina-Alva, P; Duque, KR; Zea-Vera, A; Bellomo, S; Carcamo, C; Guillen-Pinto, D; Rivas, M; Tori, A; Zegarra, J; Cam, L; Castaneda, A; Villavicencio, A; Ochoa, TJ",,,,"Medina-Alva, Pilar; Duque, Kevin R.; Zea-Vera, Alonso; Bellomo, Sicilia; Carcamo, Cesar; Guillen-Pinto, Daniel; Rivas, Maria; Tori, Alfredo; Zegarra, Jaime; Cam, Luis; Castaneda, Anne; Villavicencio, Aasith; Ochoa, Theresa J.",,,Combined predictors of neurodevelopment in very low birth weight preterm infants,EARLY HUMAN DEVELOPMENT,,,,,,,,,,,,"Objective: To evaluate the combined prognostic value of neurological examination, head circumference and cranial ultrasound for neurodevelopmental delay (NDD) in very low birth weight (VLBW, < 1500 g) preterm infants. Methods: Prospective follow-up study. Preterm infants with VLWB were assessed for NDD using the Mullen Scales of Early Learning test at 24 months of corrected age. Abnormal neurological examination (>= 2 deviant items of Hammersmith neurological examination), microcephaly and major ultrasound abnormalities, each performed at term age, were evaluated as predictors of NDD in a multivariable Poisson model. Results: 35/132 infants (26.5%) had NDD. In the multivariable analysis, microcephaly (RR, 3.2; 95% CI, 1.6-6.7) and major ultrasound abnormalities (RR, 2.7; 95% CI, 1.3-5.7) were associated to NDD. The combination of the two tests showed the highest positive predictive value (100%; 95% CI, 51%-100%), while the combination of normal neurological examination, no major US findings and normal head size at term showed the highest negative predictive value (89%; 95% CI, 78%-95%). The maximum under receiver operating characteristic curve area was for microcephaly or major ultrasound abnormalities (AUC 0.74 (0.65-0.83)). Conclusion: The combination of head circumference, cranial ultrasound and neurological examination at term age is useful to predict NDD in VLBW preterm infants.",,,,,"Zea Vera, Alonso G/AAO-8943-2021; Duque, Kevin R./AGX-9937-2022; Vera, Alonso Zea/V-4515-2019","Zea Vera, Alonso G/0000-0002-8172-3117; Duque, Kevin R./0000-0002-5981-3140; Medina-Alva, Pilar/0000-0002-2475-5171",,,,,,,,,,,,,0378-3782,1872-6232,,,,MAR,2019,130.0,,,,,,109,115,,10.1016/j.earlhumdev.2019.01.019,0,,,,,,,,30743197.0000,,,,,WOS:000462801000017,0.0
J,"Herzig, PM; Hannington, MD; Arribas, A",,,,"Herzig, PM; Hannington, MD; Arribas, A",,,Sulfur isotopic composition of hydrothermal precipitates from the Lau back-arc: implications for magmatic contributions to seafloor hydrothermal systems,MINERALIUM DEPOSITA,,,,,,,,,,,,"The sulfur isotopic composition of sulfides and barite from hydrothermal deposits at the Valu Fa Ridge back-are spreading center in the southern Lau Basin has been investigated. Sulfide samples from the White Church area at the northern Valu Fa Ridge have delta(34)S values averaging +3.8 parts per thousand (n = 10) for bulk sphalerite-chalcopyrite mineralization and +4.8 parts per thousand for pyrite (It = IO). Barite associated with the massive sulfides exhibits an average of +20.7 parts per thousand, (rr = 10). Massive sulfides from the active Vai Lili hydrothermal field at the central Valu Fa Ridge have much higher delta(34)S ratios averaging +8.0 parts per thousand for bulk sphalerite-chalcopyrite mineralization (n = 5), +9.3 parts per thousand for pyrite samples (n = 5), and +8.0 parts per thousand, and +10.9 parts per thousand for a chalcopyrite and a sphalerite separate, respectively. The isotopic composition of barite from the Vai Lili field is similar to that of barite from the White Church area and averages +21.0 parts per thousand (n = 8). Sulfide and barite samples from the Hine Hina area at the southern Valu Fa Ridge have delta(34)S values that are considerably lighter than those observed for samples from the other areas and average -4.9 parts per thousand, for pyrite (n = 9), -4.0 and -5.7 parts per thousand for two samples of sphalerite-chalcopyrite intergrowth, and -3.4 parts per thousand, for a single chalcopyrite separate. The total spread in the isotopic composition of sulfides from Vai Lili and Hine Hina is more than 20 parts per thousand over a distance of less than 30 km. The delta(34)S values of sulfides at Hine Hina are the lowest values so far reported for volcanic-hosted polymetallic massive sulfides from the modem seafloor. Barite from the Hine Hina field also has unusually light sulfur with delta(34)S values of +16.1 to +16.7 parts per thousand, (n = 5). Isotopic compositions of the sulfides at Hine Hina indicate a dramatic decrease in delta(34)S from ordinary magmatic values and. in the absence of biogenic sulfur and/or boiling. imply a unique S-34-depleted source of probable magmatic origin. Sulfide-barite mineralization in the Hine Hina area is associated with a distinctive alteration assemblage consisting of cristobalite, pyrophyllite, kaolinite, opal-CT, talc. pyrite, native sulfur, and alunite. Similar styles of alteration are typically known from high-sulfidation epithermal systems on land. Alunite-bearing, advanced argillic alteration in the Hine Hina field confirms the role of acidic. volatile-rich fluids, and a delta(34)S value of +10.4 parts per thousand for the sulfur in the alunite is consistent with established kinetic isotope effects which accompany the disproportionation of magmatic SO2 into H2S and H2SO4. The Hine Hina field occurs near the propagating tip of the Valu Fa back-are spreading center (i.e., dominated by dike injections and seafloor eruptions) and therefore may have experienced the largest contribution of magmatic volatiles of the three fields. The sulfur isotopic ratios of the hydrothermal precipitates and the presence of a distinctive epithermal-like argillic alteration in the Hine Hina field suggest a direct contribution of magmatic vapor to the hydrothermal system and support the concept that magmatic volatiles may be an important component of some volcanogenic massive sulfide-forming hydrothermal systems.",,,,,,,,,,,,,,,,,,,0026-4598,,,,,MAR,1998,33.0,3,,,,,226,237,,10.1007/s001260050143,0,,,,,,,,,,,,,WOS:000073026300002,0.0
J,"Zeljko, TV; Pavlek, M; Mestrovic, N; Plohl, M",,,,"Zeljko, Tanja Vojvoda; Pavlek, Martina; Mestrovic, Nevenka; Plohl, Miroslav",,,Satellite DNA-like repeats are dispersed throughout the genome of the Pacific oyster Crassostrea gigas carried by Helentron non-autonomous mobile elements,SCIENTIFIC REPORTS,,,,,,,,,,,,"Satellite DNAs (satDNAs) are long arrays of tandem repeats typically located in heterochromatin and span the centromeres of eukaryotic chromosomes. Despite the wealth of knowledge about satDNAs, little is known about a fraction of short, satDNA-like arrays dispersed throughout the genome. Our survey of the Pacific oyster Crassostrea gigas sequenced genome revealed genome assembly replete with satDNA-like tandem repeats. We focused on the most abundant arrays, grouped according to sequence similarity into 13 clusters, and explored their flanking sequences. Structural analysis showed that arrays of all 13 clusters represent central repeats of 11 non-autonomous elements named Cg_HINE, which are classified into the Helentron superfamily of DNA transposons. Each of the described elements is formed by a unique combination of flanking sequences and satDNA-like central repeats, coming from one, exceptionally two clusters in a consecutive order. While some of the detected Cg_HINE elements are related according to sequence similarities in flanking and repetitive modules, others evidently arose in independent events. In addition, some of the Cg_HINE's central repeats are related to the classical C. gigas satDNA, interconnecting mobile elements and satDNAs. Genome-wide distribution of Cg_HINE implies non-autonomous Helentrons as a dynamic system prone to efficiently propagate tandem repeats in the C. gigas genome.",,,,,"Plohl, Miroslav/AAQ-6428-2021; Pavlek, Martina/AAD-9359-2019",,,,,,,,,,,,,,2045-2322,,,,,SEP 15,2020,10.0,1,,,,,,,15107,10.1038/s41598-020-71886-y,0,,,,,,,,32934255.0000,,,,,WOS:000573753200047,0.0
J,"Lambicchi, L; Ornaghi, S; Dal Molin, G; Paterlini, G; Bernasconi, DP; Moltrasio, F; Vergani, P",,,,"Lambicchi, Laura; Ornaghi, Sara; Dal Molin, Giulia; Paterlini, Giuseppe; Bernasconi, Davide P.; Moltrasio, Francesca; Vergani, Patrizia",,,Different antecedents and neonatal condition in neonatal arterial ischemic stroke and hypoxic-ischemic neonatal encephalopathy,INTERNATIONAL JOURNAL OF GYNECOLOGY & OBSTETRICS,,,,,,,,,,,,"Objective To define similarities and differences between neonatal arterial ischemic stroke (NAIS) and hypoxic-ischemic neonatal encephalopathy (HINE). Methods A retrospective case-control study was conducted of neonates born at 35 weeks or more and weighing 1800 g or more at a tertiary care university hospital, between 2005 and 2016, with NAIS (group A), perinatal asphyxia (PA) with Stage II-III HINE (group B), and PA with or without Stage I HINE (group C). Ante- and intrapartum data, neonatal characteristics, and placental histopathology were compared. Results Eleven neonates were identified in group A, 10 in group B, and 227 in group C. Sentinel events occurred exclusively in groups B (80%) and C (41.4%). Umbilical cord blood gas values and Apgar score were worse in groups B and C compared to group A. No group A neonates required resuscitation at birth, whereas all group B and one-third of group C neonates did. Seizures developed only in neonates in groups A and B. One neonatal death occurred in group A. There were no significant differences in placental histopathology. Conclusion NAIS and PA/HINE cases have different intrapartum and neonatal features. PA does not seem necessary for the occurrence of NAIS. More research is needed regarding associated placental abnormalities.",,,,,"Ornaghi, Sara/GXW-2481-2022; Vergani, Patrizia/H-4580-2011; Ornaghi, Sara/K-4261-2018","Ornaghi, Sara/0000-0001-6898-7217; BERNASCONI, DAVIDE PAOLO/0000-0001-8771-5428",,,,,,,,,,,,,0020-7292,1879-3479,,,,MAY,2022,157.0,2,,,,,333,339,,10.1002/ijgo.13781,0,,JUN 2021,,,,,,34101180.0000,,,,,WOS:000664340200001,0.0
J,"Maunu, J; Lehtonen, L; Lapinleimu, H; Matomaki, J; Munck, P; Rikalainen, H; Parkkola, R; Haataja, L",,,,"Maunu, Jonna; Lehtonen, Liisa; Lapinleimu, Helena; Matomaki, Jaakko; Munck, Petriina; Rikalainen, Hellevi; Parkkola, Riitta; Haataja, Leena",,Pipari Study Grp,Ventricular dilatation in relation to outcome at 2 years of age in very preterm infants: a prospective Finnish cohort study,DEVELOPMENTAL MEDICINE AND CHILD NEUROLOGY,,,,,,,,,,,,"Aim The aim of this study was to analyse the relation between ventricular dilatation at term and neurodevelopmental outcome at 2 years corrected age in infants of very low birthweight (VLBW) or very low gestational age (VLGA). Method A total of 225 VLBW or VLGA infants (121 males, 104 female; mean birthweight 1133g, SD 333g; mean gestational age 29wks, SD 2wks 5d) born in Turku University Hospital were included. Ventricular-brain ratio and the widths of each lateral ventricular horn were determined using ultrasonography, and the volume of the ventricles was measured by magnetic resonance imaging at term. The 2-year outcome measures included scores for the Hammersmith Infant Neurological Examination, the presence of cerebral palsy (CP), the Mental Developmental Index (MDI) of the Bayley Scales of Infant Development (2nd edition), and the presence of severe hearing or vision impairments or any neurodevelopmental impairment (NDI). Results CP was diagnosed in 15 participants (6.7%) and severe hearing deficit in 12 participants (5.3%). No severe vision impairment was found. Mild and severe cognitive delay was found in 24 (10.7%) and 8 (3.6%) of the VLBW or VLGA infants respectively. Isolated ventricular dilatation did not increase the risk for developmental impairments. However, ventricular dilatation with additional brain pathology was significantly associated with CP, MDI score below 70, and NDI. A ventricular-brain ratio above 0.35 was a sensitive measure of developmental impairment. Interpretation Ventricular dilatation at term increases the risk of poor developmental outcome only when associated with other brain pathology. The ventricular-brain ratio is a useful clinical tool for determining the prognosis in VLBW and VLGA infants.",,,,,"Stolt, Suvi/V-5060-2018; Lapinleimu, Helena/AAT-8415-2021; Parkkola, Riitta/AAZ-1341-2020; Haataja, Leena/GPG-3986-2022; Haataja, Leena/G-1160-2016; Munck, Petriina/AAF-6418-2020","Stolt, Suvi/0000-0002-6029-5459; Haataja, Leena/0000-0002-8057-6194; Lehtonen, Liisa/0000-0001-8925-2594; Munck, Petriina/0000-0002-3226-8170",,,,,,,,,,,,,0012-1622,1469-8749,,,,JAN,2011,53.0,1,,,,,48,54,,10.1111/j.1469-8749.2010.03785.x,0,,,,,,,,21039438.0000,,,,,WOS:000284891900013,0.0
J,"Scoles, GA; Miller, JA; Foil, LD",,,,"Scoles, Glen A.; Miller, J. Allen; Foil, Lane D.",,,"Comparison of the efficiency of biological transmission of Anaplasma marginale (Rickettsiales : Anaplasmataceae) by Dermacentor andersoni stiles (Acari : Ixodidae) with mechanical transmission by the horse fly, Tabanus fuscicostatus hine (Diptera : Muscidae) (vol 45, pg 109, 2008)",JOURNAL OF MEDICAL ENTOMOLOGY,,,,,,,,,,,,,,,,,,,,,,,,,,,,,,,0022-2585,,,,,MAY,2008,45.0,3,,,,,IV,IV,,,,,,,,,,,,,,,,WOS:000257259500001,0.0
J,"Svabova, J; Valkova, J; Haberlova, J",,,,"Svabova, J.; Valkova, J.; Haberlova, J.",,,The functional assessment and tests for children patients with spinal muscular atrophy,CESKA A SLOVENSKA NEUROLOGIE A NEUROCHIRURGIE,,,,,,,,,,,,"Introduction to functional tests and scales used by Neuromuscular center in the University Hospital in Motol. These examinations of motor skills for patients with spinal muscular atrophy were developed and are used to evaluate the state of complex motor functions to evaluate the natural course of spinal muscular atrophy. They are especially important for the treatment with Spinraza determination of default state with the aim to observe the efficiency on motor functions. For now, motor scales mentioned in the text are only a marker of the available treatment, therefore extremely needed.",,,,,,,,,,,,,,,,,,,1210-7859,1802-4041,,,,,2020,83.0,,,2,,,S24,S26,,10.48095/cccsnn2S24,0,,,,,,,,,,,,,WOS:000631103800008,0.0
J,"Videman, M; Stjerna, S; Roivainen, R; Nybo, T; Vanhatalo, S; Gaily, E; Leppanen, JM",,,,"Videman, Mari; Stjerna, Susanna; Roivainen, Reina; Nybo, Taina; Vanhatalo, Sampsa; Gaily, Eija; Leppanen, Jukka M.",,,Evidence for spared attention to faces in 7-month-old infants after prenatal exposure to antiepileptic drugs,EPILEPSY & BEHAVIOR,,,,,,,,,,,,"Introduction: Prenatal antiepileptic drug (AED) exposure is associated with an increased risk of cognitive impairment and autism spectrum disorders detected mainly at the age of two to six years. We examined whether the developitiental aberrations associated with prenatal AED exposure-could be-detected already in infancy and whether effects on visual attention can be observed at this early age. Material and methods: We compared a prospective cohort of infants with in utero exposure to AED (n = 56) with infants without drug exposures (n = 62). The assessments performed at the age of seven months included standardized neurodevelopmental scores (Griffiths Mental Developmental Scale and Hammersmith Infant Neurological Examination) as well as a novel eye-tracking-based test for visual attention and orienting to faces. Background information included prospective collection of AED exposure data, pregnancy outcome, neuropsychological evaluation of the mothers, and information on maternal epilepsy type. Results: Carbamazepine, oxcarbazepine, and valproate, but not lamotrigine or levetiracetam, were associated with impaired early language abilities at the age of seven months. The general speed of visuospatial orienting or attentional bias for faces measured by eye-tracker-based tests did not differ between AED-exposed and control infants. Discussion: Our findings support the idea that prenatal AED exposure may impair verbal abilities, and this effect may be detected already in infancy. In contrast, the early development of attention to faces was spared after in utero AED exposure. (C) 2016 Elsevier Inc. All rights reserved.",,,,,"Videman, Mari/AAW-8324-2020","Roivainen, Reina/0000-0002-6504-7032",,,,,,,,,,,,,1525-5050,1525-5069,,,,NOV,2016,64.0,,,,,,62,68,,10.1016/j.yebeh.2016.09.023,0,,,,,,,,27732918.0000,,,,,WOS:000389734800012,0.0
J,"Morris, E; Forman, D; Haward, B",,,,"Morris, E.; Forman, D.; Haward, B.",,,"The impact of the Calman-Hine report: analysis of breast and colorectal cancer surgical workloads and the degree of surgical site specialization in the Yorkshire region of the UK, 1990-2000",EUROPEAN JOURNAL OF CANCER CARE,,,,,,,,,,,,"The 1995 Calman-Hine report set out the first overall cancer policy for England and Wales, with the aim of improving the quality of care offered to cancer patients. One of its key recommendations was to concentrate cancer care in the hands of site-specialist doctors. This retrospective population-based study aimed to determine whether this recommendation has been implemented across the Yorkshire region of the UK (population 3.6 million) for breast and colorectal cancer surgery. Information on all breast and colorectal cancer patients diagnosed between 1990 and 2000 within the former Yorkshire Regional Health Authority of the UK was obtained from the Northern and Yorkshire Cancer Registry and Information Service. The annual median workloads of each surgeon operating on these patients, in terms of breast and/or colorectal cancer, were calculated. Each surgeon was categorized as either specialist or non-specialist based on his or her self-stated interests or workload. The proportion of breast and colorectal patients in each Trust and in each year receiving surgery from a site specialist was calculated to determine the extent of surgical site specialization. The distribution of surgeons' workloads in breast and colorectal cancer surgery was also examined across three time periods; 1990-93, 1994-97 and 1998-2000. There has been a major shift towards surgical site specialization in breast and colorectal cancer care across Yorkshire. The effect was more marked in breast cancer than in colorectal cancer. The degree of surgical site specialization varied considerably across hospital Trusts. In both cancer sites, the move towards surgical site specialization began prior to the publication of the Calman-Hine report.",,,,,,,,,,,,,,,,,,,0961-5423,,,,,MAR,2007,16.0,2,,,,,150,155,,10.1111/j.1365-2354.2006.00723.x,0,,,,,,,,17371424.0000,,,,,WOS:000244942500007,0.0
S,"Fu, XH; Wang, ZQ; Feng, BQ",,"Wang, G; Peters, JF; Skowron, YY; Yao, YY",,"Fu, Xianghua; Wang, Zhiqiang; Feng, Boqin",,,A constructive algorithm for training heterogeneous neural network ensemble,"ROUGH SETS AND KNOWLEDGE TECHNOLOGY, PROCEEDINGS",Lecture Notes in Artificial Intelligence,,,,1st International Conference on Rough Sets and Knowledge Technology (RSKT 2006),"JUL 24-26, 2006","Chongqing, PEOPLES R CHINA","Int Rough Set Soc, Rough Set & Soft Computat Soc, Chinese Assoc Artificial Intelligence, Natl Nat Sci Fdn China, Chongqing Univ Posts & Telecommun, Chongqing Inst Technol, Chongqing Jiaotong Univ, Chongqing Educ Commiss, Chongqing Sci & Technol Commiss, Chongqing Informat Ind Bur, Chongqing Assoc Sci & Technol",,,,"This paper presents a new algorithm to construct a neural network ensemble (NNE) based on heterogeneous component neural networks with negative correlation learning. The constructive algorithm consists of two parts: a sub-algorithm to construct best heterogeneous component neural networks with negative correlation learning dynamically (CBHNN), and a sub-algorithm to construct heterogeneous NNE with trained heterogeneous neural networks incrementally (CHNNE). The experiment results showe that HNNE is better than the traditional homological NNE method.",,,,,,,,,,,,,,,,,,,0302-9743,1611-3349,3-540-36297-5,,,,2006,4062.0,,,,,,396,401,,,,,,,,,,,,,,,,WOS:000239623500057,0.0
J,"Leppanen, M; Ekholm, E; Palo, P; Maunu, J; Munck, P; Parkkola, R; Matomaki, J; Lapinleimu, H; Haataja, L; Lehtonen, L; Rautava, P",,,,"Leppanen, M.; Ekholm, E.; Palo, P.; Maunu, J.; Munck, P.; Parkkola, R.; Matomaki, J.; Lapinleimu, H.; Haataja, L.; Lehtonen, L.; Rautava, P.",,PIPARI Study Grp,Abnormal antenatal Doppler velocimetry and cognitive outcome in very-low-birth-weight infants at 2 years of age,ULTRASOUND IN OBSTETRICS & GYNECOLOGY,,,,,,,,,,,,"Objective To study neurodevelopmental outcome at 2 years of corrected age in very-low-birth-weight (VLBW) (<= 1500 g) preterm infants with abnormal fetoplacental flow. Methods A total of 258 VLBW infants were born at Turku University Hospital between 2001 and 2006. Of these, 99 had undergone, within 1 week of delivery, antenatal Doppler assessment of blood flow in the umbilical artery (UA), fetal middle cerebral artery (MCA), descending aorta (DAo), aortic isthmus and ductus venosus and were eligible for inclusion in the study. Postnatally brain pathology was assessed by serial ultrasound and magnetic resonance imaging in 86 of the neonates and brain volume was measured in 80. Cognitive development was evaluated at 2 years of corrected age in 83 infants using the Bayley Scales of Infant Development-II. Motor development was assessed using the Hammersmith Infant Neurological Examination. Results On univariate analysis, abnormal pulsatility index (PI) in the UA and an abnormal UA-PI/MCA-PI ratio (P = 0.04 and P = 0.003, respectively) as well as increases in both the DAo-PI and in the DAo-PI/MCA-PI ratio (P = 0.03 and P = 0.02, respectively), were associated with adverse cognitive outcome at 2 years of age. However, when controlling for cerebral volume using multivariate analysis, the association between abnormal antenatal Doppler characteristics and cognitive outcome became statistically non-significant, which indicated the determinant role of the volume reduction. Motor development was not associated with antenatal Doppler indices. Conclusion Abnormal antenatal Doppler indices are associated with adverse cognitive outcome at 2 years in VLBW infants. Our findings suggest that this association may be mediated through brain volume. Copyright (C) 2010 ISUOG. Published by John Wiley & Sons, Ltd.",,,,,"Munck, Petriina/AAF-6418-2020; Lapinleimu, Helena/AAT-8415-2021; Stolt, Suvi/V-5060-2018; Haataja, Leena/GPG-3986-2022; Parkkola, Riitta/AAZ-1341-2020; Haataja, Leena/G-1160-2016","Stolt, Suvi/0000-0002-6029-5459; Haataja, Leena/0000-0002-8057-6194; Munck, Petriina/0000-0002-3226-8170; Lehtonen, Liisa/0000-0001-8925-2594; Leppanen, Marika/0000-0002-7948-8533",,,,,,,,,,,,,0960-7692,1469-0705,,,,AUG,2010,36.0,2,,,,,178,185,,10.1002/uog.7694,0,,,,,,,,20503251.0000,,,,,WOS:000281086100010,0.0
J,"Merino-Andres, J; Hidalgo-Robles, A; Perez-Nombela, S; Williams, SA; Paleg, G; Fernandez-Rego, FJ",,,,"Merino-Andres, Javier; Hidalgo-Robles, Alvaro; Perez-Nombela, Soraya; Williams, Sian A.; Paleg, Ginny; Javier Fernandez-Rego, Francisco",,,Tool Use for Early Detection of Cerebral Palsy: A Survey of Spanish Pediatric Physical Therapists,PEDIATRIC PHYSICAL THERAPY,,,,,,,,,,,,"Purpose: The purpose of this study was to assess the use of diagnostic assessment tools in pediatric physical therapy practice in Spain. Best practice recommendations indicate the timely use of key assessment tools to reduce the age of diagnosis of cerebral palsy (CP). Methods: Pediatric physical therapists currently working in Spain in early intervention were recruited through targeted physical therapy entities. They were invited to complete the purpose-developed electronic survey, consisting of 45 multiple-choice questions, with 5 thematic blocks. Results: Results from 140 anonymous respondents were analyzed. The average reported age when CP was suspected was 12.6 months. Most used the child's clinical history (88.1%), the Alberta Infant Motor Scale (41.3%), and Vojta Assessment Procedure (32.1%) to assess and detect CP. General Movements Assessment (25.7%) and Hammersmith Infant Neurological Examination (28.4%) were used infrequently. Conclusions: Currently, pediatric physical therapists in Spain rely on clinical history and outdated tools to identify children with CP. Digital Abstract available at:, http://links.lww.com/PPT/A361,  (English). Digital Abstract available at: , http://links.lww.com/PPT/A362,  (Spanish). (Pediatr Phys Ther 2022;34:202-210)",,,,,,"Hidalgo Robles, Alvaro/0000-0001-6294-7476; Merino Andres, Javier/0000-0002-7647-0258",,,,,,,,,,,,,0898-5669,1538-005X,,,,APR,2022,34.0,2,,,,,202,210,,10.1097/PEP.0000000000000877,0,,,,,,,,35385454.0000,,,,,WOS:000789201100016,0.0
J,"Tataru, D; Robinson, D; Moller, H; Davies, E",,,,"Tataru, Daniela; Robinson, David; Moller, Henrik; Davies, Elizabeth",,,Trends in the treatment of breast cancer in Southeast England following the introduction of national guidelines,JOURNAL OF PUBLIC HEALTH,,,,,,,,,,,,"There is little published evidence on trends in the treatment of breast cancer in England following the publication of the Calman-Hine report in 1995. Reliable national data are available for women with screen-detected breast cancer, but data on women presenting symptomatically have been difficult to collect. Using data from both a clinical audit database and a population-based cancer register, we show that between 1996 and 2003 the rates of mastectomy and chemotherapy treatment for women with breast cancer in Southeast England have increased marginally, whereas there has been a steady decline in the use of hormone therapy and radiotherapy recorded within 6 months of diagnosis.",,,,,,"Moller, Henrik/0000-0001-8200-5929; Davies, Elizabeth/0000-0003-2325-0849",,,,,,,,,,,,,1741-3842,,,,,SEP,2006,28.0,3,,,,,215,217,,10.1093/pubmed/fdl011,0,,,,,,,,16644905.0000,,,,,WOS:000240586900007,0.0
