J,"Dogra, DP; Majumdar, AK; Sural, S; Mukherjee, J; Mukherjee, S; Singh, A",,,,"Dogra, D. P.; Majumdar, A. K.; Sural, S.; Mukherjee, J.; Mukherjee, S.; Singh, A.",,,Analysis of adductors angle measurement in Hammersmith infant neurological examinations using mean shift segmentation and feature point based object tracking,COMPUTERS IN BIOLOGY AND MEDICINE,,,,,,,,,,,,"This paper presents image and video analysis based schemes to automate the process of adductors angle measurement which is carried out on infants as a part of Hammersmith Infant Neurological Examination (HINE). Image segmentation, thinning and feature point based object tracking are used for automating the analysis. Segmentation outputs are processed with a novel region merging algorithm. It is found that the refined segmentation outputs can successfully be used to extract features in the context of the application under consideration. Next, a heuristic based filtering algorithm is applied on the thinned structures for locating necessary points to measure adductors angle. A semi-automatic scheme based on the object tracking of a video has been proposed to minimize errors of the image based analysis. It is observed that the video-based analysis outperforms the image-based method. A fully automatic method has also been proposed and compared with the semi-automatic algorithm. The proposed methods have been tested with several videos recorded from hospitals and the results have been found to be satisfactory in the present context. (C) 2012 Elsevier Ltd. All rights reserved.",,,,,,,,,,,,,,,,,,,0010-4825,1879-0534,,,,SEP,2012,42.0,9,,,,,925,934,,10.1016/j.compbiomed.2012.07.005,0,,,,,,,,22841364.0000,,,,,WOS:000308973800008,0.0
J,"Pineda, R; Wallendorf, M; Smith, J",,,,"Pineda, Roberta; Wallendorf, Michael; Smith, Joan",,,A pilot study demonstrating the impact of the supporting and enhancing NICU sensory experiences (SENSE) program on the mother and infant,EARLY HUMAN DEVELOPMENT,,,,,,,,,,,,"Aim: To explore differences in maternal mental health and infant neurobehavioral outcome among infants who received and did not receive the Supporting and Enhancing NICU Sensory Experiences (SENSE) program. Study design: Eighty preterm infants (50 receiving standard-of-care and 30 receiving the SENSE program) born <= 32 weeks gestation were enrolled within the first week of life in a prospective quasi-experimental design, using a historical control group for comparison. Standard-of-care consisted of tactile (skin-to-skin, touch, holding) and olfactory (scent cloth, close maternal contact) interventions as determined to be appropriate by health care professionals and parents. The SENSE group received specific doses of tactile (skin-to-skin care, holding, massage, touch), auditory (human speech, music), olfactory (scent cloth, close maternal contact), kinesthetic/vestibular (movement, rocking/transfers), and visual (dim or cycled light) exposures, based on the infant's postmenstrual age and tailored to medical status and infant cues according to the SENSE program. The SENSE program includes the intentional delivery of positive, age-appropriate sensory exposures by parents (or a sensory support team, when parents are unavailable) each day of NICU hospitalization. Infant neurobehavioral outcome, as well as maternal mental health and confidence, were assessed prior to NICU discharge, using standardized measures. Results: Seventy-three infants were included in the final analysis. Mothers whose infants received the SENSE program demonstrated higher scores on the Maternal Confidence Questionnaire (p = 0.01). Infants who received the SENSE program demonstrated less asymmetry on the NICU Network Neurobehavioral Scale (p = 0.02; mean difference 0.9) and higher scores on the Hammersmith Neonatal Neurological Evaluation (p < 0.001; mean difference 4.8). Discussion: Preliminary evidence demonstrates improvements in maternal confidence and infant neurobehavioral performance following SENSE implementation.",,,,,,,,,,,,,,,,,,,0378-3782,1872-6232,,,,MAY,2020,144.0,,,,,,,,105000,10.1016/j.earlhumdev.2020.105000,0,,,,,,,,32151905.0000,,,,,WOS:000538595900008,0.0
J,"Luciano, R; Baranello, G; Masini, L; Ricci, D; Gallini, F; Ciotti, S; Leone, D; Serrao, F; De Santis, M; Zecca, E; Zuppa, A; Romagnoli, C; Di Rocco, C; Guzzetta, F; Mercuri, E",,,,"Luciano, R.; Baranello, G.; Masini, L.; Ricci, D.; Gallini, F.; Ciotti, S.; Leone, D.; Serrao, F.; De Santis, M.; Zecca, E.; Zuppa, A.; Romagnoli, C.; Di Rocco, C.; Guzzetta, F.; Mercuri, E.",,,Antenatal post-hemorrhagic ventriculomegaly: A prospective follow-up study,NEUROPEDIATRICS,,,,,,,,,,,,"Objective: The aim of this study was to evaluate the presence and the severity of neurological and cognitive impairment at 2 years of age in 16 infants (9 term born, 7 preterm of mean gestation 33.6 weeks) with cerebral ventriculomegaly of antenatal onset associated with intraventricular haemorrhage. Methods: Ventricular dilatation, with or without associated lesions, was, with one exception, not identified on the antenatal routine scan at approximately 22 weeks but was obvious on the scans performed between weeks 27 and 33. In 8 of the 16 cases there were signs of parenchymal involvement or of abnormalities of the corpus callosum or cerebellum. In all patients the diagnosis of antenatal IVH was confirmed by early neonatal imaging. Outcome was measured using the Hammersmith infant neurological examination and the Griffiths developmental scales at 2 years. Results and Conclusions: At 2 years, 8 infants had normal motor outcome and 8 had cerebral palsy. The presence and severity of cerebral palsy or neurodevelopmental delay was not always related to the magnitude or symmetry of the ventricular dilatation per se. The presence of associated lesions was a negative prognostic marker. The early development of epilepsy was also associated with an abnormal outcome.",,,,,"Ricci, Daniela/AAC-3415-2022","ricci, daniela/0000-0002-3547-7592; LUCIANO, Rita Paola Maria/0000-0003-4358-0757; LEONE, Daniela/0000-0001-5078-143X",,,,,,,,,,,,,0174-304X,1439-1899,,,,JUN,2007,38.0,3,,,,,137,142,,10.1055/s-2007-985366,0,,,,,,,,17985263.0000,,,,,WOS:000251245200008,0.0
J,"Allinson, LG; Denehy, L; Doyle, LW; Eeles, AL; Dawson, JA; Lee, KJ; Spittle, AJ",,,,"Allinson, Leesa G.; Denehy, Linda; Doyle, Lex W.; Eeles, Abbey L.; Dawson, Jennifer A.; Lee, Katherine J.; Spittle, Alicia J.",,,Physiological stress responses in infants at 29-32 weeks' postmenstrual age during clustered nursing cares and standardised neurobehavioural assessments,BMJ PAEDIATRICS OPEN,,,,,,,,,,,,"Objective To compare the physiological stress responses of infants born Design/methods Thirty-four infants born <30 weeks' gestation were recruited from a tertiary neonatal intensive care unit. Heart rate (HR) and oxygen saturation were recorded during clustered nursing cares and during standardised neurobehavioural assessments (including the General Movements Assessment, Hammersmith Neonatal Neurological Examination and Premie-Neuro Assessment). Two assessors extracted HR and oxygen saturations at 5 s intervals, with HR instability defined either as tachycardia (HR >180 beats per minute (bpm)) or bradycardia (HR <100 bpm). Oxygen desaturations were defined as SpO(2)<90%. Physiological stability was compared between nursing cares and neurobehavioural assessments using linear (for continuous outcomes) and logistic (HR instability and oxygen desaturation) regression. Results Compared with clustered nursing cares HR was lower (mean difference -5.9 bpm; 95% CI -6.5 to 5.3; P<0.001) and oxygen saturation higher (mean difference 2.4%; 95% CI 2.1% to 2.6%; P<0.001) during standardised neurobehavioural assessments. Compared with clustered nursing cares neurobehavioural assessments were also associated with reduced odds of tachycardia (OR 0.44, 95% CI 0.22 to 0.86), HR instability (OR 0.43, 95% CI 0.22 to 0.85) and oxygen desaturation (OR 0.43, 95% CI 0.26 to 0.70). Conclusions Standardised neurobehavioural assessments are associated with less physiological stress than clustered nursing cares in infants aged 29-32 weeks' postmenstrual age, and are therefore possible without causing undue physiological disturbance in medically stable infants.",,,,,,"Dawson, Jennifer/0000-0003-2357-6283; Doyle, Lex/0000-0002-7667-7312",,,,,,,,,,,,,,2399-9772,,,,NOV,2017,1.0,1,,,,,,,e000025,10.1136/bmjpo-2017-000025,0,,,,,,,,29637097.0000,,,,,WOS:000641975700015,0.0
J,"Hadders-Algra, M",,,,"Hadders-Algra, Mijna",,,Early Diagnostics and Early Intervention in Neurodevelopmental Disorders-Age-Dependent Challenges and Opportunities,JOURNAL OF CLINICAL MEDICINE,,,,,,,,,,,,"This review discusses early diagnostics and early intervention in developmental disorders in the light of brain development. The best instruments for early detection of cerebral palsy (CP) with or without intellectual disability are neonatal magnetic resonance imaging, general movements assessment at 2-4 months and from 2-4 months onwards, the Hammersmith Infant Neurological Examination and Standardized Infant NeuroDevelopmental Assessment. Early detection of autism spectrum disorders (ASD) is difficult; its first signs emerge at the end of the first year. Prediction with the Modified Checklist for Autism in Toddlers and Infant Toddler Checklist is possible to some extent and improves during the second year, especially in children at familial risk of ASD. Thus, prediction improves substantially when transient brain structures have been replaced by permanent circuitries. At around 3 months the cortical subplate has dissolved in primary motor and sensory cortices; around 12 months the cortical subplate in prefrontal and parieto-temporal cortices and cerebellar external granular layer have disappeared. This review stresses that families are pivotal in early intervention. It summarizes evidence on the effectiveness of early intervention in medically fragile neonates, infants at low to moderate risk, infants with or at high risk of CP and with or at high risk of ASD.",,,,,"Hadders-Algra, Mijna/AAM-9180-2021","Hadders-Algra, Mijna/0000-0001-6845-5114",,,,,,,,,,,,,,2077-0383,,,,FEB,2021,10.0,4,,,,,,,861,10.3390/jcm10040861,0,,,,,,,,33669727.0000,,,,,WOS:000624049500001,0.0
J,"Romeo, DM; Bompard, S; Cocca, C; Serrao, F; De Carolis, MP; Zuppa, AA; Ricci, D; Gallini, F; Maddaloni, C; Romagnoli, C; Mercuri, E",,,,"Romeo, Domenico M.; Bompard, Sarah; Cocca, Carmen; Serrao, Francesca; De Carolis, Maria Pia; Zuppa, Antonio A.; Ricci, Daniela; Gallini, Francesca; Maddaloni, Chiara; Romagnoli, Costantino; Mercuri, Eugenio",,,Neonatal neurological examination during the first 6 h after birth,EARLY HUMAN DEVELOPMENT,,,,,,,,,,,,"Background: Few neurological assessments are easily performed during the first 6 h after birth. Aims: To assess a cohort of low risk term born newborns within the first 6 h and at 48 h after birth using the Hammersmith Neonatal Neurological Examination. Study design and subjects: A population of low risk term born newborns was examined within 3 h from birth or between 3 and 6 h. Each infant was re-assessed at 48 h, establishing the range and frequency distribution of neonatal neurological scores at each time point. Results: Of the 124 full-term born newborns, 62 were assessed at 0-3 h and 62 at 3-6 h. All infants were re-assessed at 48 h. For 23/34 of the neurological items, the range and median scores were similar across the 3 time points. In the remaining 11 items the three groups had a similar range of scores but the median scores were different with different rates of changes. In 6 of the 11 the median scores at 3-6 h were similar to those observed at 48 h but they appeared to be 'less mature' at 0-3 h. Only in one item the median scores were consistently different at the 3 time points. Conclusions: Our results suggest that a neurological examination can already be reliably performed soon after birth. These findings will help in the interpretation of the few items that show changes with increasing postnatal age. (C) 2017 Elsevier B.V. All rights reserved.",,,,,"Romeo, Domenico M/K-7957-2016; Ricci, Daniela/AAC-3415-2022; Romeo, Domenico/AFM-6244-2022; Mercuri, Eugenio/G-1351-2015","Romeo, Domenico M/0000-0002-6229-1208; Maddaloni, Chiara/0000-0002-4265-0939; Mercuri, Eugenio/0000-0002-9851-5365; ricci, daniela/0000-0002-3547-7592; Bompard, Sarah/0000-0001-6622-0485",,,,,,,,,,,,,0378-3782,1872-6232,,,,MAY,2017,108.0,,,,,,41,44,,10.1016/j.earlhumdev.2017.03.013,0,,,,,,,,28390243.0000,,,,,WOS:000403627700007,0.0
J,"Benfer, KA; Novak, I; Morgan, C; Whittingham, K; Khan, NZ; Ware, RS; Bell, KL; Bandaranayake, S; Salt, A; Ghosh, AK; Bhattacharya, A; Samanta, S; Moula, G; Bose, D; Tripathi, S; Boyd, RN",,,,"Benfer, Katherine A.; Novak, Iona; Morgan, Catherine; Whittingham, Koa; Khan, Naila Zaman; Ware, Robert S.; Bell, Kristie L.; Bandaranayake, Sasaka; Salt, Alison; Ghosh, Asis Kumar; Bhattacharya, Anjan; Samanta, Sandip; Moula, Golam; Bose, Dilip; Tripathi, Santanu; Boyd, Roslyn N.",,,Community-based parent-delivered early detection and intervention programme for infants at high risk of cerebral palsy in a low-resource country (Learning through Everyday Activities with Parents (LEAP-CP): protocol for a randomised controlled trial,BMJ OPEN,,,,,,,,,,,,"Introduction Cerebral palsy (CP) is the most common childhood physical disability, with 80% estimated to be in low-middle-income countries. This study aims to (1) determine the accuracy of General Movements (GMs)/Hammersmith Infant Neurological Examination (HINE) for detecting CP at 18 months corrected age (CA); (2) determine the effectiveness of a community-based parent delivered early intervention for infants at high risk of CP in West Bengal, India (Learning through Everyday Activities with Parents for infants with CP; LEAP-CP). Methods This study comprises two substudies: (1) a study of the predictive validity of the GMs and HINE for detecting CP; (2) randomised, double-blinded controlled trial of a novel intervention delivered through peer trainers (Community Disability Workers, CDW) compared with health advice (15 fortnightly visits). 142 infants at high risk of CP ('absent fidgety' GMs; 'high risk score' on HINE) aged 12-40weeks CA will he recruited to the intervention substudy, with infants randomised based on a computer generated sequence. Researchers will be masked to group allocation, and caregivers and CDWs naive to intervention status. Visits will include therapeutic modules (goal directed active motor/cognitive strategies and LEAP-CP games) and parent education. Health advice is based on the Integrated Management of Childhood Illness, WHO. Infants will he evaluated at baseline, post intervention and 18 months CA. The primary hypothesis is that infants receiving LEAP-CP will have greater scaled scores on the Pediatric Evaluation of Disability Inventory Computer Adaptive Test (mobility domain) at 18 months compared with health advice. Secondary outcomes include infant functional motor, cognitive, visual and communication development; infant growth; maternal mental health. Ethics and dissemination This study is approved through appropriate Australian and Indian ethics committees (see in text) with families providing written informed consent. Findings from this trial will he disseminated through peer-reviewed journal publications and conference presentations.",,,,,"Bell, Kristie L/C-1327-2014; Bell, Kristie/AAZ-5445-2021; Novak, Iona E/B-3061-2014; Boyd, Roslyn N/A-4498-2011; Whittingham, Koa/C-6766-2009; Ware, Robert/B-2024-2014","Bell, Kristie L/0000-0002-4795-1079; Bell, Kristie/0000-0002-4795-1079; Novak, Iona E/0000-0001-6001-4867; Boyd, Roslyn N/0000-0002-4919-5975; Whittingham, Koa/0000-0002-5344-9907; Ware, Robert/0000-0002-6129-6736",,,,,,,,,,,,,2044-6055,,,,,JUN,2018,8.0,6,,,,,,,e021186,10.1136/bmjopen-2017-021186,0,,,,,,,,29934387.0000,,,,,WOS:000442924700058,0.0
J,"Pane, M; Coratti, G; Sansone, VA; Messina, S; Catteruccia, M; Bruno, C; Sframeli, M; Albamonte, E; Pedemonte, M; Brolatti, N; Mizzoni, I; D'Amico, A; Bravetti, C; Berti, B; Palermo, C; Leone, D; Salmin, F; De Sanctis, R; Pera, MC; Piastra, M; Genovese, O; Ricci, F; Cavallina, I; Masson, R; Zanin, R; Agosto, C; Salomon, E; Bruno, I; Magnolato, A; Bertini, E; Tiziano, FD; Bovis, F; Mercuri, E; Italian EAP Working Grp",,,,"Pane, Marika; Coratti, Giorgia A.; Sansone, Valeria; Messina, Sonia; Catteruccia, Michela; Bruno, Claudio; Sframeli, Maria; Albamonte, Emilio; Pedemonte, Marina; Brolatti, Noemi; Mizzoni, Irene; D'Amico, Adele; Bravetti, Chiara; Berti, Beatrice; Palermo, Concetta; Leone, Daniela; Salmin, Francesca; De Sanctis, Roberto; Pera, Maria Carmela; Piastra, Marco; Genovese, Orazio; Ricci, Federica; Cavallina, Ilaria; Masson, Riccardo; Zanin, Riccardo; Agosto, Caterina; Salomon, Eleonora; Bruno, Irene; Magnolato, Andrea; Bertini, Enrico; Tiziano, Francesco Danilo; Bovis, Francesca; Mercuri, Eugenio; Italian EAP Working Grp",,,"Type I spinal muscular atrophy patients treated with nusinersen: 4-year follow-up of motor, respiratory and bulbar function",EUROPEAN JOURNAL OF NEUROLOGY,,,,,,,,,,,,"Background: We report the 4-year follow-up in type I patients treated with nusinersen and the changes in motor, respiratory and bulbar function in relation to subtype, age and SMN2 copy number.Methods: The study included SMA 1 patients with at least one assessment after 12, 24 and 48 months from the first dose of nusinersen. The assessments used were Children's Hospital of Philadelphia Infant Test of Neuromuscular Disorders (CHOP INTEND) and the Hammersmith Infant Neurological Examination (HINE-II).Results: Forty-eight patients, with ages ranging from 7 days to 12 years (mean 3.3 years, SD 3.6 years) were included in the study. The CHOP INTEND and HINE-II scores significantly increased between baseline and 48 months (p < 0.001). When age at starting treatment subgroups (<210 days, <2 years, 2-4 years, 5-11 years, =12 years) were considered, the CHOP INTEND increased significantly in patients younger than 4 years at treatment, while the HINE-2 increased significantly in patients younger than 2 years at treatment. In a mixed-model analysis, age, nutritional and respiratory status were predictive of changes on both scales while SMN2 copy number and decimal classification were not.Conclusions: Our results confirm the safety profile previously reported and support the durability of the efficacy of nusinersen at 4 years with an overall stability or mild improvement and no evidence of deterioration over a long period of time.",,,,,,,,,,,,,,,,,,,1351-5101,1468-1331,,,,,,,,,,,,,,,10.1111/ene.15768,0,,APR 2023,,,,,,36880698.0000,,,,,WOS:000962582400001,0.0
J,"Pane, M; Coratti, G; Sansone, VA; Messina, S; Catteruccia, M; Bruno, C; Sframeli, M; Albamonte, E; Pedemonte, M; D'Amico, A; Bravetti, C; Berti, B; Palermo, C; Leone, D; Brigati, G; Tacchetti, P; Salmin, F; De Sanctis, R; Lucibello, S; Pera, MC; Piastra, M; Genovese, O; Bertini, E; Vita, G; Tiziano, FD; Mercuri, E",,,,"Pane, Marika; Coratti, Giorgia; Sansone, Valeria A.; Messina, Sonia; Catteruccia, Michela; Bruno, Claudio; Sframeli, Maria; Albamonte, Emilio; Pedemonte, Marina; D'Amico, Adele; Bravetti, Chiara; Berti, Beatrice; Palermo, Concetta; Leone, Daniela; Brigati, Giorgia; Tacchetti, Paola; Salmin, Francesca; De Sanctis, Roberto; Lucibello, Simona; Pera, Maria Carmela; Piastra, Marco; Genovese, Orazio; Bertini, Enrico; Vita, Gianluca; Tiziano, Francesco Danilo; Mercuri, Eugenio",,Italian EAP Working Grp,Type I SMA new natural history: long-term data in nusinersen-treated patients,ANNALS OF CLINICAL AND TRANSLATIONAL NEUROLOGY,,,,,,,,,,,,"Objective: The aim of this paper was to report the 2-year follow-up in type I patients treated with Nusinersen and to assess whether possible changes in motor function are related to the subtype, age, or SMN2 copy number. Methods: Sixty-eight patients, with ages ranging from 0.20 to 15.92 years (mean: 3.96; standard deviation: +/- 3.90) were enrolled in the study. All patients were assessed using the Children's Hospital of Philadelphia Infant Test of Neuromuscular Disorders (CHOP INTEND) and the developmental section of the Hammersmith Infant Neurological Examination (HINE-2) at the time they started treatment and 12 and 24 months after that. Results: For both CHOP and HINE-2 repeated measures analysis of variance showed a significant difference (P < 0.001) between baseline and 12 months, 12 months and 24 months, and baseline and 24-month scores for the whole group. When age subgroups (<210 days, <2 years, 2-4 years, 5-11 years, 12-18 years) were considered, on the CHOP INTEND the difference was significant between baseline and 24 months in all age subgroups. On the HINE-2, the difference between baseline and 24 months was significant in all the subgroups before the age of 4 years. Age was predictive of changes on both scales (P < 0.05), whereas SMN2 copy number and decimal classification were not. Interpretation: Our results suggest that some improvement of motor function can be observed even after the first year of treatment. This is more obvious in the infants treated in the first 2 years but some improvement can also be found in older children.",,,,,"Coratti, Giorgia/Y-6292-2019; Leone, Daniela/AAC-7450-2022; Berti, Beatrice/AAC-7216-2022; Tiziano, Francesco Danilo/A-7260-2010; Coratti, Giorgia/AAV-3224-2021; Masson, Riccardo/AAB-8896-2019; Lucibello, Simona/AAB-6848-2022; Pera, Maria Carmela/J-6068-2018","Coratti, Giorgia/0000-0001-6666-5628; Berti, Beatrice/0000-0002-5698-9415; Tiziano, Francesco Danilo/0000-0002-5545-6158; Coratti, Giorgia/0000-0001-6666-5628; Masson, Riccardo/0000-0002-9311-452X; Lucibello, Simona/0000-0003-0970-5755; Messina, Sonia/0000-0001-7994-3391; Pera, Maria Carmela/0000-0001-6777-1721; Brigati, Giorgia/0000-0002-8040-5950; Pane, Marika/0000-0002-4851-6124; Vita, Gianluca/0000-0003-4190-8042;, chiara bravetti/0000-0002-9963-8316; ALBAMONTE, EMILIO/0000-0002-8465-4460; SANSONE, Valeria Ada Maria/0000-0002-1354-3800",,,,,,,,,,,,,2328-9503,,,,,MAR,2021,8.0,3,,,,,548,557,,10.1002/acn3.51276,0,,FEB 2021,,,,,,33547876.0000,,,,,WOS:000615341600001,0.0
J,"Caesar, R; Colditz, PB; Cioni, G; Boyd, RN",,,,"Caesar, Rebecca; Colditz, Paul B.; Cioni, Giovanni; Boyd, Roslyn N.",,,Clinical tools used in young infants born very preterm to predict motor and cognitive delay (not cerebral palsy): a systematic review,DEVELOPMENTAL MEDICINE AND CHILD NEUROLOGY,,,,,,,,,,,,"Aim This systematic review evaluates the accuracy of clinical tools used at a corrected age of 6 months or younger to predict motor and cognitive delay (not cerebral palsy) at 24 months' corrected age, in infants born very preterm. Method Six databases were searched. Quality was evaluated using the Quality Assessment of Diagnostic Accuracy Studies tool. Predictive analysis included calculation of sensitivity and specificity, inspection of summary receiver operating characteristics curves, and bivariate meta-analysis. Results Six assessments were identified in 10 studies of 992 infants. Overall prevalence of motor delay was 13.8% and cognitive delay was 11.7%. Methodological quality was variable for patient selection, reference standard, flow, and timing. All studies had a low risk of bias for the index test. General Movement Assessment (GMA) predicted motor and cognitive outcomes with good accuracy for mild, moderate, and severe delays (fidgety age: pooled diagnostic odds ratio=12.3 [5.9-29.8]; hierarchical summary receiver operating characteristics curve=0.733). The Hammersmith Infant Neurological Examination (HINE) demonstrated excellent predictive accuracy for severe motor delay (3mo and 6mo; sensitivity 93% [68-100%], specificity 100% [96-100%]) but showed limited ability to predict milder delays. Interpretation In the population of infants born very preterm, few assessment tools used at 6 months or younger corrected age have proven predictive accuracy for cognitive and motor delay at 24 months' corrected age. Only the GMA and HINE demonstrated useful predictive validity.",,,,,"Cioni, Giovanni/A-4178-2015; Boyd, Roslyn N/A-4498-2011; Colditz, Paul/F-6772-2010","Cioni, Giovanni/0000-0002-6526-5566; Boyd, Roslyn N/0000-0002-4919-5975; Caesar, Rebecca/0000-0002-9681-4847; Colditz, Paul/0000-0002-6408-8238",,,,,,,,,,,,,0012-1622,1469-8749,,,,APR,2021,63.0,4,,,,,387,395,,10.1111/dmcn.14730,0,,NOV 2020,,,,,,33185285.0000,,,,,WOS:000588718100001,0.0
J,"Ljungblad, UW; Paulsen, H; Tangeraas, T; Evensen, KAI",,,,"Ljungblad, Ulf Wike; Paulsen, Henriette; Tangeraas, Trine; Evensen, Kari Anne I.",,,The Hammersmith Infant Neurological Examination: Concern about low scores in typically developing infants born at term Reply,JOURNAL OF PEDIATRICS,,,,,,,,,,,,,,,,,,"Ljungblad, Ulf Wike/0000-0003-2826-9952",,,,,,,,,,,,,0022-3476,1097-6833,,,,JUL,2022,246.0,,,,,,287,288,,10.1111/apa. 16133 5,,,,,,,,,35358585.0000,,,,,WOS:000814869400055,0.0
J,"Vollmer, B; Martinez-Biarge, M; Romeo, DM",,,,"Vollmer, Brigitte; Martinez-Biarge, Miriam; Romeo, Domenico M.",,,The Hammersmith Infant Neurological Examination: Concern about low scores in typically developing infants born at term,JOURNAL OF PEDIATRICS,,,,,,,,,,,,,,,,,"Martinez-Biarge, Miriam/HCH-8730-2022","Vollmer, Brigitte/0000-0003-4088-5336",,,,,,,,,,,,,0022-3476,1097-6833,,,,JUL,2022,246.0,,,,,,286,287,,10.1016/j.jpeds.2022.03.047,0,,,,,,,,35358584.0000,,,,,WOS:000814869400054,0.0
