J,"Khongcharoensombat, T; Khemtong, A; Lakananurak, N",,,,"Khongcharoensombat, Thanon; Khemtong, Autthapon; Lakananurak, Narisorn",,,Pectin-containing compared with standard polymeric formula in enteral nutrition: A randomized controlled parallel study in Thailand,ASIA PACIFIC JOURNAL OF CLINICAL NUTRITION,,,,,,,,,,,,"Background and Objectives: To evaluate the effects of a Ready to Hang ( RTH), pectin-containing enteral nutrition on gastrointestinal symptoms and nutrition status. Methods and Study Design: An open-label, randomized, prospective controlled study. Thirty hospitalized patients with tube feeding for 9 days or more. Intervention: A pectin-containing enteral formula (Hine E-Gel (R)) or a standard polymeric formula (Ensure (R)) was administered for 1 week. Administration methods: Administered via a nasogastric tube 4 times per day (every 6 hours), 30 minutes per administration. Results: There was no significant difference in the frequency of diarrhea or the nutritional indicators. An additional survey was conducted of 50 nurses who were involved in the administration of the study products. Most respondents replied that the RTH, pectin-containing formula was easier to use and that the duties related to its administration were decreased. Conclusions: The pectin-containing formula was not detectably superior to the standard polymeric formula in terms of gastrointestinal symptoms. The use of RTH may simplify medical care and enable efficient management.",,,,,,,,,,,,,,,,,,,0964-7058,1440-6047,,,,MAR,2021,30.0,1,,,,,67,74,,10.6133/apjcn.202103_30(1).0009,0,,,,,,,,33787042.0000,,,,,WOS:000636696700009,0.0
J,"Lewis, BJ; Husain, A",,,,"Lewis, BJ; Husain, A",,,Derivation of geometry factors for internal gamma dose calculations for a cylindrical radioactive waste package,NUCLEAR TECHNOLOGY,,,,,,,,,,,,"A general methodology was developed to estimate geometry factors for internal gamma dose rate calculations within a cylindrical radioactive waste container. In particular, an average geometry factor is needed to calculate the average energy deposition rate within the container for determination of the internal gas generation rate. Such a calculation is required in order to assess the potential for radioactive waste packages to radiolytically generate combustible gases. This work therefore provides a method for estimating the point and average geometry factors for internal dose assessment for a cylindrical geometry. This analysis is compared to other results where it is shown that the classical work of Hine and Brownell do not correspond to the average geometry factors for a cylindrical body but rather to values at the center of its top or bottom end The current treatment was further developed into a prototype computer code (PC-CAGE) that calculates the geometry factors numerically for a cylindrical body of any size and material, accounting both for gamma absorption and buildup effects.",,,,,,,,,,,,,,,,,,,0029-5450,,,,,DEC,2002,140.0,3,,,,,279,287,,10.13182/NT02-A3339,0,,,,,,,,,,,,,WOS:000179651600004,0.0
J,"Yoshimura, S; Ikuse, K; Kiuchi, M; Nishimoto, Y; Yasuda, M; Baba, A; Hamaguchi, S",,,,"Yoshimura, S.; Ikuse, K.; Kiuchi, M.; Nishimoto, Y.; Yasuda, M.; Baba, A.; Hamaguchi, S.",,,Dependence of catalytic properties of indium implanted SiO2 thin films on the film-substrate temperature during indium ion implantation,NUCLEAR INSTRUMENTS & METHODS IN PHYSICS RESEARCH SECTION B-BEAM INTERACTIONS WITH MATERIALS AND ATOMS,,,,,,,,,,,,"Chemical substances that contain indium (In) and silicon (Si) in close proximity are known to catalyze certain organic chemical reactions. An earlier paper [Yoshimura, Hine, Kiuchi, Nishimoto, Yasuda, Baba, Hamaguchi, Appl. Surf. Sci. 257 (2010) 192] has demonstrated that In implanted silicon dioxide (SiO2) films formed at room temperature catalyze a reaction of benzhydrol with acetylacetone. This study, thus, examined effects of substrate temperature during In ion implantation, revealing that, if In ions were implanted into a SiO2 film at the substrate holder temperature of 200 degrees C or higher, the film exhibited no catalytic ability. Surface analyses by the X-ray diffraction, the X-ray photoelectron spectroscopy, and the atomic force microscopy indicated that, at such high temperature, implanted In atoms either formed separate phases of metallic In on the SiO2 film surface or were simply nonexistent due to vaporization. (C) 2013 Elsevier B.V. All rights reserved.",,,,,"Kiuchi, Masato/L-5229-2018","Kiuchi, Masato/0000-0002-6365-3952; Nishimoto, Yoshihiro/0000-0002-7182-0503; Yasuda, Makoto/0000-0002-6618-2893",,,,,,,,,,,,,0168-583X,1872-9584,,,,NOV 15,2013,315.0,,,,,,222,226,,10.1016/j.nimb.2013.04.072,0,,,,,,,,,,,,,WOS:000327921300048,0.0
J,"Fogg, PGT",,,,"Fogg, PGT",,,Some aspects of the solubility of gases in liquids,MONATSHEFTE FUR CHEMIE,,,,,,,,,,,,Henry's law constants may usually be used to calculate solubilities of gases at low pressures. If experimental measurements are unavailable values of Henry's law constants may be estimated by various methods. Several of these methods depend upon quantitative structure-property relationships. A method developed by Hine and Mookerjee depends on the assumption that each bond of a particular type makes approximately the same contribution to the molar free energy change when different organic gases are dissolved in water. The solubility of gases and also the rate at which gases dissolve in cloud droplets is important for the understanding of processes which occur in the atmosphere. A simple model for the uptake of gases by water is based on an analogy with the behaviour of an electric circuit containing resistances in series and in parallel. This model is important for the interpretation of experimental measurements of rates of gas uptake.,,,,,,,,,,,,,,,,,,,0026-9247,,,,,MAY,2003,134.0,5,,,,,619,631,,10.1007/s00706-002-0580-x,0,,,,,,,,,,,,,WOS:000182968400003,0.0
J,"LEPRINCE, DJ; FOIL, LD",,,,"LEPRINCE, DJ; FOIL, LD",,,"RELATIONSHIPS AMONG BODY-SIZE, BLOOD MEAL SIZE, EGG VOLUME, AND EGG-PRODUCTION OF TABANUS-FUSCICOSTATUS (DIPTERA, TABANIDAE)",JOURNAL OF MEDICAL ENTOMOLOGY,,,,,,,,,,,,"Number of ovarioles, egg production, and weight of unfed and bloodfed Tabanus fuscicostatus Hine females were related linearly to wing length. Wing length did not change whether flies were freshly thawed, preserved in formalin solution, or oven dried. Left and right wings were similar in length. The length from the costa to the anterior cross vein or to the intersection of R4 and R5 veins was associated linearly to wing length. The number of eggs produced by flies bloodfed on one or two bovine hosts was similar when adjusted by wing length. The average number of ovarioles per female was 277 +/- 50 (+/-SD), and eggs developed in only 63% of the ovarioles after a bloodmeal. An estimated 3.1 eggs were produced for each milligram of blood ingested by a fly, and the average bloodmeal size was 110% of the unfed weight of the flies (49.7 mg). Egg volume was unrelated to body size, but was associated inversely with the number of eggs produced per female.",,,,,,,,,,,,,,,,,,,0022-2585,,,,,SEP,1993,30.0,5,,,,,865,871,,10.1093/jmedent/30.5.865,0,,,,,,,,8254632.0000,,,,,WOS:A1993LV97700004,0.0
J,"Lee, AHS; Mead, GM; Theaker, JM",,,,"Lee, AHS; Mead, GM; Theaker, JM",,,The value of central histopathological review of testicular tumours before treatment,BJU INTERNATIONAL,,,,,,,,,,,,"Objective. To assess the value of central histopathological review of testicular tumours. Materials and methods. The histopathology reports of the referring hospital and central review were compared for all referred testicular specimens (201 orchidectomies and seven testicular biopsies) from 11 hospitals in one region, between 1992 and 1997. Results. There were two main findings: First, there was a major discrepancy of tumour type in 12 specimens (6%). The most frequent change (in five cases) was from seminoma to nonseminomatous germ cell tumour (NSGCT). There were also difficulties with uncommon tumours such as spermatocytic seminoma, lymphoma and adenocarcinoma. Treatment was changed as result of the altered diagnosis in eight of these 12 patients. Second, there were discrepancies of interpretation of vascular invasion in 12 of 59 NSGCTs (20%). Differences of tumour elements recognized in NSGCTs were frequent. Conclusions. The errors discovered on central histopathological review of testicular tumours were significant, though small in number. This supports the idea of central review and is consistent with the specialization recommended in the Calman-Hine cancer arrangements.",,,,,,,,,,,,,,,,,,,1464-4096,,,,,JUL,1999,84.0,1,,,,,75,78,,,,,,,,,,,10444128.0000,,,,,WOS:000081433300015,0.0
J,"Murage, P; Crawford, SM; Bachmann, M; Jones, A",,,,"Murage, Peninah; Crawford, S. Michael; Bachmann, Max; Jones, Andy",,,Geographical disparities in access to cancer management and treatment services in England,HEALTH & PLACE,,,,,,,,,,,,"This study seeks to examine the extent to which cancer services are geographically located according to cancer incidence, and assess the association with cancer survival. We identified hospital sites serving English PCTs (Primary Care Trusts) with the management and treatment of breast, lung and colorectal cancer. Geographical access was estimated as travel time in minutes from LSOAs (Lower Super Output Areas) to the nearest hospital site and aggregated to PCT level. Correlations between PCT level mean travel times and cancer cases were estimated using Spearman's rank correlation. Associations between PCT level mean travel times and cancer relative survival rates were estimated using linear regression with adjustment for area deprivation and for a PCT level measure of the reported ease of obtaining a doctor's appointment. We found that cancer services tended to be located farther from areas with more cancer cases, and longer average travel times are associated with worse survival after adjustment for age, sex, year and area deprivation. This suggests that geographical access to cancer services remains a concern in England. (C) 2016 Elsevier Ltd. All rights reserved.",,,,,,"Murage, Peninah/0000-0002-4506-0897; Bachmann, Max Oscar/0000-0003-1770-3506",,,,,,,,,,,,,1353-8292,1873-2054,,,,NOV,2016,42.0,,,,,,11,18,,10.1016/j.healthplace.2016.08.014,0,,,,,,,,27614062.0000,,,,,WOS:000389161000002,0.0
J,"Levet, A; Ozdemir, Y",,,,"Levet, A.; Ozdemir, Y.",,,"Determination of effective atomic numbers, effective electrons numbers, total atomic cross-sections and buildup factor of some compounds for different radiation sources",RADIATION PHYSICS AND CHEMISTRY,,,,,,,,,,,,"The photon interaction parameters such as mass attenuation coefficient, effective atomic number, effective electron density, buildup factor have been measured for Fe(NO3)(3), V4O2, NaCO3 center dot H2O, C6H3FeO7 center dot H2O and CuCI compounds using Ba-132, Gd-152 and Am-241 gamma-rays sources in stable geometry. The mass attenuation coefficients have been determined experimentally via Energy Dispersive X-ray Fluorescence Spectroscopy (EDXRF) system and theoretically by using WinXCom computer program. Then, effective atomic numbers, Z(eff), and electron densities, N-eff, have been calculated by using the mass attenuation coefficients. The obtained values of effective atomic numbers have been compared with the ones calculated according to a different approach proposed by Hine and the calculated ones from theory. Also, photon buildup factors were obtained by changing collimator diameters in the different photon energies. We observed that the buildup factor increased as the collimator diameter increased for all sources used. (C) 2016 Elsevier Ltd. All rights reserved.",,,,,,"Levet, Aytac/0000-0002-1086-5732",,,,,,,,,,,,,0969-806X,,,,,JAN,2017,130.0,,,,,,171,176,,10.1016/j.radphyschem.2016.08.015,0,,,,,,,,,,,,,WOS:000388777200026,0.0
J,"Alexander, D; Davies, T; Shulmeister, J",,,,"Alexander, David; Davies, Timothy; Shulmeister, James",,,"Formation of the Waiho Loop terminal moraine, New Zealand",JOURNAL OF QUATERNARY SCIENCE,,,,,,,,,,,,"We present an analysis of the formation and evolution of the Waiho Loop terminal moraine. Recent work has shown that the Loop comprises mainly rock avalanche material, and suggested its formation was associated with a rock-avalanche-driven glacier advance. New evidence from shallow seismic studies between the range front and the Loop suggests (i) that the presence of a basal trough critically influences glacier behaviour and moraine formation; and (ii) that the volume of the Waiho Loop is significantly greater than previously thought. A one-dimensional dynamic ice flow model is used to test two rock-avalanche-based scenarios for the formation of the Loop: first, that a rock avalanche caused a significant advance of the glacier terminus from a location within the confined mountain valley to the Loop; and second, that the rock avalanche occurred while the glacier was retreating with its terminus close to the position of the Loop. It is shown that this terminal moraine was not the result of a glacier advance.",,,,,"Shulmeister, James/J-2859-2015","Shulmeister, James/0000-0001-5863-9462",,,,,,,,,,,,,0267-8179,1099-1417,,,,MAY,2014,29.0,4,,,,,361,369,,10.1002/jqs.2707,0,,,,,,,,,,,,,WOS:000335961100006,0.0
J,"Birchall, MA",,,,"Birchall, MA",,S W Expert Tumour Panel Head Neck Canc,Consensus standards for the process of cancer care: a modified expert panel method applied to head and neck cancer,BRITISH JOURNAL OF CANCER,,,,,,,,,,,,"There are many pressures to improve the standard of care delivered to cancer patients, including the reforms subsequent to the Calman-Hine report. The establishment of standards is a prerequisite for audit, benchmarking and certification of cancer centres and units. Randomized trials of head and neck cancer are uncommon, and other forms of evidence often conflicting. In the south and west of England, a multidisciplinary expert panel consensus method has been applied to the development of standards. A panel representative of specialties involved in the process of care at all three levels, plus social medicine and lay members, was constructed. A model for the process of care was developed consisting of activity areas. For each activity, a near exhaustive list of tasks and standards was established. A three-iteration method with statistical group response was then used to refine the standards. The same method was also applied to the production of a minimum data set for registration, recording and audit. The resulting standards will be regularly reviewed. We have developed a model of the care process, and an expert panel methodology that is applicable to a wide range of problems in clinical oncology.",,,,,,,,,,,,,,,,,,,0007-0920,,,,,JUN,1998,77.0,11,,,,,1926,1931,,10.1038/bjc.1998.319,0,,,,,,,,9667669.0000,,,,,WOS:000080207600032,0.0
J,"Watson, DW; Denning, SS; Calibeo-Hayes, DI; Stringham, SM; Mowrey, RA",,,,"Watson, D. W.; Denning, S. S.; Calibeo-Hayes, D. I.; Stringham, S. M.; Mowrey, R. A.",,,Comparison of two fly traps for the capture of horse flies (Diptera : Tabanidae),JOURNAL OF ENTOMOLOGICAL SCIENCE,,,,,,,,,,,,"A 2-yr study was conducted to examine differences between two commercially available horse fly traps, the Epps (R) Biting Fly Trap (Farnum Co., Phoenix, AZ) and the Horse Pal (R) (Newman Enterprises, Omro, WI), placed on three horse farms located in central North Carolina. Traps captured over 8, 422 tabanids, representing 4 genera and 19 species. Tabanus quinquevittatus Wiedemann was the most abundant fly collected (2345), followed by the T. lineola F. species complex (2087), T. fulvulus Weidemann (1397) and T. petiolatus Hine (839). Although the Horse Pal captured more flies than the Epps trap, fly capture differences between traps were not significant for the 2000 and 2001 summer seasons (F = 1.39; df = 3, 143; P <= 0.249). The Epps trap was most efficacious for early-season (June and July) trapping of T. quinquevittatus and the T. lineola complex in 2000. In contrast, the Horse Pal was more efficacious for these species during the same period in 2001. The Horse Pal was the preferred trap for relative ease in handling.",,,,,,,,,,,,,,,,,,,0749-8004,,,,,APR,2007,42.0,2,,,,,123,132,,10.18474/0749-8004-42.2.123,0,,,,,,,,,,,,,WOS:000246633200001,0.0
J,"DESBRUYERES, D; ALAYSEDANET, AM; OHTA, S; ANTOINE, E; BARBIER, G; BRIAND, P; GODFROY, A; CRASSOUS, P; JOLLIVET, D; KERDONCUFF, J; KHRIPOUNOFF, A; LAUBIER, L; MARCHAND, M; PERRON, R; DERELLE, E; DINET, A; FIALAMEDIONI, A; HASHIMOTO, J; NOJIRI, Y; PRIEUR, D; RUELLAN, E; SOAKAI, S",,,,"DESBRUYERES, D; ALAYSEDANET, AM; OHTA, S; ANTOINE, E; BARBIER, G; BRIAND, P; GODFROY, A; CRASSOUS, P; JOLLIVET, D; KERDONCUFF, J; KHRIPOUNOFF, A; LAUBIER, L; MARCHAND, M; PERRON, R; DERELLE, E; DINET, A; FIALAMEDIONI, A; HASHIMOTO, J; NOJIRI, Y; PRIEUR, D; RUELLAN, E; SOAKAI, S",,,"DEEP-SEA HYDROTHERMAL COMMUNITIES IN SOUTHWESTERN PACIFIC BACK-ARC BASINS (THE NORTH FIJI AND LAU BASINS) - COMPOSITION, MICRODISTRIBUTION AND FOOD-WEB",MARINE GEOLOGY,,,,,,,,,,,,"During the year 1989, two diving cruises of the French deep-sea submersible Nautile were devoted to the study of hydrothermal vent biology in spreading centers of two Southwestern Pacific back-arc basins (Lau Basin and North Fiji Basin). In both cases, two major active sites were visited: White Lady and Mussel Valley in the North Fiji Basin and Hine Hina and Vai Lili in Lau Basin. The faunal associations clustered around active vents are dominated by two species of snails Ifremeria nautilei and Alviniconcha hessleri and one or two species of mytilids belonging to Bathymodiolus. These species are associated with chemoautolithotrophic bacteria in intracellular symbiosis as detected by the activity of the Calvin-Benson cycle diagnostic enzyme RuBPcase. Pedunculate and sessile barnacles dominated the outer rim of the site and are analogs of the fiter-feeding serpulids living in the EPR sites. The hot extremes of the sites are poorly or not colonized by alvinellids or other taxa. In the Lau Basin, ''cold seep'' sites are found at the periphery of active hot or warm ventsand are dominated by vestimentiferans and pogonophorans. No major differences were seen between associations of the two back-arc basins at the generic level with the exeption of the abundance of synaptid holothurians associated with Bathymodiolus in side the ''Mussel Valley'' site.",,,,,"Godfroy, Anne/X-1992-2018; Nojiri, Yukihiro/D-1999-2010; Anne, Godfroy/J-9897-2017","Godfroy, Anne/0000-0003-0483-4160; Nojiri, Yukihiro/0000-0001-9885-9195; Anne, Godfroy/0000-0003-0483-4160; RUELLAN, Etienne/0000-0002-0063-800X",,,,,,,,,,,,,0025-3227,1872-6151,,,,JAN,1994,116.0,1-2,,,,,227,242,,10.1016/0025-3227(94)90178-3,0,,,,,,,,,,,,,WOS:A1994NA87600015,0.0
J,"Buraschi, D; Bustillos, A; Huici, C",,,,"Buraschi, Daniel; Bustillos, Antonio; Huici, Carmen",,,"Attitudes toward Immigrants, Beliefs about Causes of Poverty and Effects of Perspective-Taking",SPANISH JOURNAL OF PSYCHOLOGY,,,,,,,,,,,,"The present work presents three studies that investigate the relationship between causal attributions of poverty in Africa, attitudes towards African immigrants and perspective-taking. The objective of preliminary study (N = 54) was to collect information to adapt the Perceived Causes of Third World Poverty Scale (Hine & Monitel, 1999), in the Spanish adaptation by Betancor et at. (2002) to Spanish adolescents. The Study 1 (N = 102) explores the factorial structure of the teenager questionnaire adaptation and to test the relationship with Modern Racism Scale (McConahay, 1986). Correlational analysis reflects the existence of a central element in the new forms of racism: Victim blaming through Personal Attributions of Poverty. The objective of Study 2 (N = 62) was to determine whether empathic induction through empathic perspective-taking (Batson et al., 1997) can ameliorate the individual's attributions of poverty concerning African immigrants among majority group members. However, the opposite effect was found, empathy induction increased Personal Attributions of poverty (eta(2)= .10). This effect was moderated by Modern Racism, simple slope test indicates t(52) = 2.49, p < .01, higher prejudiced participants increased Personal Attribution of poverty after empathic induction, blaming the victims for their situation.",,,,,"Huici, Carmen/E-4577-2015; Bustillos, Antonio/L-4668-2014","Huici, Carmen/0000-0002-1137-3289; Bustillos, Antonio/0000-0003-2142-9335",,,,,,,,,,,,,1138-7416,1988-2904,,,,DEC 20,2018,21.0,,,,,,,,e66,10.1017/sjp.2018.65,0,,,,,,,,30569885.0000,,,,,WOS:000453908400001,0.0
J,"Wang, D; Kaab, A",,,,"Wang, Di; Kaab, Andreas",,,Modeling Glacier Elevation Change from DEM Time Series,REMOTE SENSING,,,,,,,,,,,,"In this study, a methodology for glacier elevation reconstruction from Digital Elevation Model (DEM) time series (tDEM) is described for modeling the evolution of glacier elevation and estimating related volume change, with focus on medium-resolution and noisy satellite DEMs. The method is robust with respect to outliers in individual DEM products. Fox Glacier and Franz Josef Glacier in New Zealand are used as test cases based on 31 Advanced Spaceborne Thermal Emission and Reflection Radiometer (ASTER) DEMs and the Shuttle Radar Topography Mission (SRTM) DEM. We obtained a mean surface elevation lowering rate of -0.51 +/- 0.02 m center dot a(-1) and -0.09 +/- 0.02 m center dot a(-1) between 2000 and 2014 for Fox and Franz Josef Glacier, respectively. The specific volume difference between 2000 and 2014 was estimated as -0.77 +/- 0.13 m center dot a(-1) and -0.33 +/- 0.06 m center dot a(-1) by our tDEM method. The comparably moderate thinning rates are mainly due to volume gains after 2013 that compensate larger thinning rates earlier in the series. Terminus thickening prevailed between 2002 and 2007.",,,,,"Wang, Di/T-2571-2018; Wang, Di/V-3305-2019; Kääb, Andreas/AAG-8769-2020","Wang, Di/0000-0003-0232-8862; Wang, Di/0000-0003-0232-8862; Kääb, Andreas/0000-0002-6017-6564",,,,,,,,,,,,,2072-4292,,,,,AUG,2015,7.0,8,,,,,10117,10142,,10.3390/rs70810117,0,,,,,,,,,,,,,WOS:000360818800029,0.0
J,"NASTASI, A; PIGNATO, S; MAMMINA, C; GIAMMANCO, G",,,,"NASTASI, A; PIGNATO, S; MAMMINA, C; GIAMMANCO, G",,,RIBOSOMAL-RNA GENE RESTRICTION PATTERNS AND BIOTYPES OF SHIGELLA-SONNEI,EPIDEMIOLOGY AND INFECTION,,,,,,,,,,,,"Shigella sonnei is a major agent of diarrhoeal disease in developed as well as in developing countries. Several phenotypic methods to define strain differences have been applied to this species of Shigella including, more recently, analysis of extrachromosomal and chromosomal DNA. In this study, 432 endemic and epidemic strains isolated between 1975 and 1991 in Italy, France and Switzerland were submitted to rRNA gene restriction pattern analysis, after digestion of whole-cell DNA by Hine II, and to concomitant biotyping. Thirteen ribotypes, H1 to H13, and five biotypes, a, d, e, f, g, were detected. Ninety-five percent of the sporadic strains were assigned to ribotypes H1 to H4, which could be subtyped, except for H4, in different biotypes. Strains from each of seven different outbreaks had indistinguishable ribotype-biotype patterns. In contrast, 65 strains, isolated in Sicily in 1980 over an extended period of apparently epidemic increase of isolations and which had previously been considered to be a single bacterial clone on the basis of resistance pattern and phage type, were found to belong to two different and scarcely related ribotypes. Ribotyping and biochemical subtyping appear to be a useful epidemiological tool in studies on the circulation and distribution of strains of S. sonnei.",,,,,"Mammina, Caterina/M-9339-2013","Mammina, Caterina/0000-0003-2881-8018",,,,,,,,,,,,,0950-2688,,,,,FEB,1993,110.0,1,,,,,23,30,,10.1017/S0950268800050640,0,,,,,,,,7679353.0000,,,,,WOS:A1993KL75900004,0.0
J,"Scarbrough, AG; Stevens, LE; Nelson, CR",,,,"Scarbrough, Aubrey G.; Stevens, Lawrence E.; Nelson, C. Riley",,,"The albibarbis-complex of Efferia Coquillett, 1910 from the Grand Canyon region, southwestern USA, with three new species and new distribution records (Diptera: Asilidae)",PAN-PACIFIC ENTOMOLOGIST,,,,,,,,,,,,"Six species of the albibarbis complex of Efferia Coquillett are reported from the Grand Canyon ecoregion on the southern Colorado Plateau in northern Arizona. The terminalia of E. albibarbis (Macquart), E. bicolor (Bellardi) E. carbonaria sp. nov., E. fisheri sp. nov.. E. tapeats sp. nov., and E. zonata (Hine) are figured and compared with congeners. Efferia peralta Wilcox and E. vertebrata (Bromley) are included as comparisons and possible members of the Grand Canyon faunas. The range of E. bicolor has been extended northward from central Arizona to within 51.5 km of the south rim of the Grand Canyon and into Nye County, Nevada. Efferia fisheri is recorded along the southern edge of the plateau at Payson, AZ, 169 km south of the GCNP. Taxonomic and distribution notes are provided. Wilcox's key of this complex is revised to include all species described since his publication. Four of the six species overlap in low-elevation perennial stream riparian zones and in adjacent colluvial brecchia habitats in the Grand Canyon region. Efferia bicolor, E. fisheri, and E. zonata overlap at higher elevations.",,,,,,,,,,,,,,,,,,,0031-0603,2162-0237,,,,JAN,2012,88.0,1,,,,,58,86,,10.3956/2012-07.1,0,,,,,,,,,,,,,WOS:000307029800005,0.0
